{
  "metadata": {
    "dataset_id": "betterreads-literary-annotation-v0.1",
    "dataset_version": "0.1.0",
    "generated_at": "2026-10-04T11:49:33Z",
    "sample_id": "heart_of_darkness_se__0000-i",
    "book": {
      "catalog_id": "heart_of_darkness_se",
      "book_id": "heart_of_darkness_se_608kb",
      "title": "Heart of Darkness",
      "author": "Joseph Conrad",
      "language": "English",
      "publisher": "Standard Ebooks",
      "source_text": {
        "original_author": "Joseph Conrad",
        "translator_status": "public_domain",
        "upstream_source": "Standard Ebooks (based on public-domain texts)",
        "source_note": "Standard Ebooks advanced EPUB. Replaces PG catalog id 219."
      },
      "reader_url": "https://www.betterreads.dev/discover/heart_of_darkness_se"
    },
    "selection": {
      "chapter_ids": [
        "0000-i"
      ],
      "rationale": "Single-chapter sample for citeable methodology work. Part I introduces Marlow's frame narrative, the Company stations, and the first mention of Kurtz."
    },
    "included_layers": [
      "chapter_text",
      "characters",
      "themes",
      "timeline",
      "glossary",
      "relationships",
      "theme_chapter_scores"
    ],
    "scope_note": "Chapter-scoped structured annotation sample; not a full-book companion dump.",
    "licenses": {
      "source_text": "Public domain (US) / CC0-equivalent reuse of PD text",
      "annotations": "CC-BY-4.0"
    },
    "attribution": {
      "creator": "Zhao Lu / BetterReads",
      "citation_text": "Zhao Lu. BetterReads Literary Annotation Dataset v0.1.0 (Heart of Darkness, Part I sample). BetterReads Research, 2026."
    },
    "counts": {
      "chapters": 1,
      "characters": 5,
      "themes": 8,
      "timeline_events": 6,
      "glossary_terms": 40,
      "relationship_nodes": 5,
      "relationship_edges": 6
    }
  },
  "chapter_map": {
    "chapters": [
      {
        "id": "0000-i",
        "title": "I",
        "full_title": "I",
        "order": 0
      }
    ]
  },
  "chapters": [
    {
      "id": "0000-i",
      "title": "I",
      "order": 0,
      "href": "text/part-1.xhtml",
      "word_count": 14282,
      "char_count": 78502,
      "text": "I\nThe\nNellie\n, a cruising yawl, swung to her anchor without a flutter of the sails, and was at rest. The flood had made, the wind was nearly calm, and being bound down the river, the only thing for it was to come to and wait for the turn of the tide.\nThe sea-reach of the Thames stretched before us like the beginning of an interminable waterway. In the offing the sea and the sky were welded together without a joint, and in the luminous space the tanned sails of the barges drifting up with the tide seemed to stand still in red clusters of canvas sharply peaked, with gleams of varnished sprits. A haze rested on the low shores that ran out to sea in vanishing flatness. The air was dark above Gravesend, and farther back still seemed condensed into a mournful gloom, brooding motionless over the biggest, and the greatest, town on earth.\nThe Director of Companies was our captain and our host. We four affectionately watched his back as he stood in the bows looking to seaward. On the whole river there was nothing that looked half so nautical. He resembled a pilot, which to a seaman is trustworthiness personified. It was difficult to realize his work was not out there in the luminous estuary, but behind him, within the brooding gloom.\nBetween us there was, as I have already said somewhere, the bond of the sea. Besides holding our hearts together through long periods of separation, it had the effect of making us tolerant of each other’s yarns⁠—and even convictions. The Lawyer⁠—the best of old fellows⁠—had, because of his many years and many virtues, the only cushion on deck, and was lying on the only rug. The Accountant had brought out already a box of dominoes, and was toying architecturally with the bones. Marlow sat cross-legged right aft, leaning against the mizzenmast. He had sunken cheeks, a yellow complexion, a straight back, an ascetic aspect, and, with his arms dropped, the palms of hands outwards, resembled an idol. The director, satisfied the anchor had good hold, made his way aft and sat down amongst us. We exchanged a few words lazily. Afterwards there was silence on board the yacht. For some reason or other we did not begin that game of dominoes. We felt meditative, and fit for nothing but placid staring. The day was ending in a serenity of still and exquisite brilliance. The water shone pacifically; the sky, without a speck, was a benign immensity of unstained light; the very mist on the Essex marsh was like a gauzy and radiant fabric, hung from the wooded rises inland, and draping the low shores in diaphanous folds. Only the gloom to the west, brooding over the upper reaches, became more sombre every minute, as if angered by the approach of the sun.\nAnd at last, in its curved and imperceptible fall, the sun sank low, and from glowing white changed to a dull red without rays and without heat, as if about to go out suddenly, stricken to death by the touch of that gloom brooding over a crowd of men.\nForthwith a change came over the waters, and the serenity became less brilliant but more profound. The old river in its broad reach rested unruffled at the decline of day, after ages of good service done to the race that peopled its banks, spread out in the tranquil dignity of a waterway leading to the uttermost ends of the earth. We looked at the venerable stream not in the vivid flush of a short day that comes and departs forever, but in the august light of abiding memories. And indeed nothing is easier for a man who has, as the phrase goes, “followed the sea” with reverence and affection, than to evoke the great spirit of the past upon the lower reaches of the Thames. The tidal current runs to and fro in its unceasing service, crowded with memories of men and ships it had borne to the rest of home or to the battles of the sea. It had known and served all the men of whom the nation is proud, from Sir Francis Drake to Sir John Franklin, knights all, titled and untitled⁠—the great knights-errant of the sea. It had borne all the ships whose names are like jewels flashing in the night of time, from the\nGolden Hind\nreturning with her rotund flanks full of treasure, to be visited by the Queen’s Highness and thus pass out of the gigantic tale, to the\nErebus\nand\nTerror\n, bound on other conquests⁠—and that never returned. It had known the ships and the men. They had sailed from Deptford, from Greenwich, from Erith⁠—the adventurers and the settlers; kings’ ships and the ships of men on ’Change; captains, admirals, the dark “interlopers” of the Eastern trade, and the commissioned “generals” of East India fleets. Hunters for gold or pursuers of fame, they all had gone out on that stream, bearing the sword, and often the torch, messengers of the might within the land, bearers of a spark from the sacred fire. What greatness had not floated on the ebb of that river into the mystery of an unknown earth!⁠ ⁠… The dreams of men, the seed of commonwealths, the germs of empires.\nThe sun set; the dusk fell on the stream, and lights began to appear along the shore. The Chapman lighthouse, a three-legged thing erect on a mudflat, shone strongly. Lights of ships moved in the fairway⁠—a great stir of lights going up and going down. And farther west on the upper reaches the place of the monstrous town was still marked ominously on the sky, a brooding gloom in sunshine, a lurid glare under the stars.\n“And this also,” said Marlow suddenly, “has been one of the dark places of the earth.”\nHe was the only man of us who still “followed the sea.” The worst that could be said of him was that he did not represent his class. He was a seaman, but he was a wanderer, too, while most seamen lead, if one may so express it, a sedentary life. Their minds are of the stay-at-home order, and their home is always with them⁠—the ship; and so is their country⁠—the sea. One ship is very much like another, and the sea is always the same. In the immutability of their surroundings the foreign shores, the foreign faces, the changing immensity of life, glide past, veiled not by a sense of mystery but by a slightly disdainful ignorance; for there is nothing mysterious to a seaman unless it be the sea itself, which is the mistress of his existence and as inscrutable as Destiny. For the rest, after his hours of work, a casual stroll or a casual spree on shore suffices to unfold for him the secret of a whole continent, and generally he finds the secret not worth knowing. The yarns of seamen have a direct simplicity, the whole meaning of which lies within the shell of a cracked nut. But Marlow was not typical (if his propensity to spin yarns be excepted), and to him the meaning of an episode was not inside like a kernel but outside, enveloping the tale which brought it out only as a glow brings out a haze, in the likeness of one of these misty halos that sometimes are made visible by the spectral illumination of moonshine.\nHis remark did not seem at all surprising. It was just like Marlow. It was accepted in silence. No one took the trouble to grunt even; and presently he said, very slow⁠—“I was thinking of very old times, when the Romans first came here, nineteen hundred years ago⁠—the other day.⁠ ⁠… Light came out of this river since⁠—you say Knights? Yes; but it is like a running blaze on a plain, like a flash of lightning in the clouds. We live in the flicker⁠—may it last as long as the old earth keeps rolling! But darkness was here yesterday. Imagine the feelings of a commander of a fine⁠—what d’ye call ’em?⁠—trireme in the Mediterranean, ordered suddenly to the north; run overland across the Gauls in a hurry; put in charge of one of these craft the legionaries⁠—a wonderful lot of handy men they must have been, too⁠—used to build, apparently by the hundred,